Question,Answer
Как добавить систему динамических изменений формы искусственных объектов?,"Добавьте систему динамических изменений формы искусственных объектов, используя анимации и морфинг. Обеспечьте возможность объектам менять свою форму в зависимости от контекста или игровых событий."
Как создать систему анимации для объектов взаимодействия и предметов?,"Создайте систему анимации для объектов взаимодействия и предметов. Привяжите анимации к действиям, выполняемым игроком или другими персонажами, чтобы создать более реалистичное взаимодействие с окружающим миром."
Как реализовать систему изменения характеристик персонажа в процессе игры?,"Реализуйте систему изменения характеристик персонажа в процессе игры. Используйте механизмы прогрессии, опыта и умений для динамического развития персонажа в ответ на его действия и достижения."
Как настроить систему управления динамическим изменением времени в игре?,"Настройте систему управления динамическим изменением времени в игре. Позвольте игрокам ускорять, замедлять или останавливать время в зависимости от сюжета или игровых условий."
Как добавить систему интеграции с физическими контроллерами и датчиками движения?,"Добавьте систему интеграции с физическими контроллерами и датчиками движения, чтобы обеспечить более интерактивный опыт. Используйте данные с контроллеров для управления движением персонажа или другими игровыми аспектами."
Как создать систему генерации динамических диалогов для неписевых персонажей?,Создайте систему генерации динамических диалогов для неписевых персонажей. Используйте алгоритмы генерации текста или базы данных диалогов для создания разнообразных и реалистичных разговоров.
Как реализовать систему изменения игровой механики в зависимости от действий игрока?,"Реализуйте систему изменения игровой механики в зависимости от действий игрока. Дайте игрокам возможность влиять на правила игры своими действиями, создавая динамичный и адаптивный геймплей."
Как добавить систему анимированных элементов интерфейса и HUD?,"Добавьте систему анимированных элементов интерфейса и HUD. Используйте анимации для выделения важных событий, информации и элементов интерфейса, чтобы сделать игровой опыт более динамичным и привлекательным."
Как создать и настроить систему управления животными и домашними питомцами?,"Создайте систему управления животными и домашними питомцами, предоставляя игрокам возможность взаимодействовать с ними, ухаживать и тренировать. Реализуйте механизмы для управления их поведением, здоровьем и уровнем счастья."
Как реализовать систему динамической мутации и эволюции игровых существ?,"Реализуйте систему динамической мутации и эволюции игровых существ, используя случайные генетические изменения и условия среды. Обеспечьте взаимодействие игровых существ между собой, создавая уникальные комбинации и виды."
Как настроить систему адаптивного звука с учетом контекста и событий в игре?,Настройте систему адаптивного звука с учетом контекста и событий в игре. Используйте алгоритмы для динамического изменения звукового пространства в зависимости от действий игрока и сценариев.
Как добавить систему создания и редактирования пользовательских квестов?,"Добавьте систему создания и редактирования пользовательских квестов, предоставляя игрокам возможность создавать свои собственные сюжетные линии и миссии. Обеспечьте инструменты для создания целей, наград и взаимодействия с игровым миром."
Как создать систему анимации для взаимодействия с интерактивными объектами?,"Создайте систему анимации для взаимодействия с интерактивными объектами. Используйте анимации, соответствующие различным действиям, чтобы сделать взаимодействие более реалистичным и привлекательным."
Как реализовать систему управления симуляцией жизни в экосистеме игры?,"Реализуйте систему управления симуляцией жизни в экосистеме игры. Учтите влияние действий игрока на баланс природы, популяции различных видов и циклы жизни существ."
Как настроить систему смены сезонов и воздействия на геймплей?,"Настройте систему смены сезонов и воздействия на геймплей. Создайте уникальные условия для каждого сезона, влияющие на поведение персонажей, доступность ресурсов и динамику игрового мира."
Как добавить систему генерации процедурных звуков и аудиоландшафта?,"Добавьте систему генерации процедурных звуков и аудиоландшафта. Используйте алгоритмы для создания разнообразных звуковых эффектов, отвечающих за изменения в окружающей среде."
Как создать и анимировать эмоции и физические реакции персонажей?,"Создайте и анимируйте эмоции и физические реакции персонажей, чтобы передать более глубокий опыт взаимодействия. Используйте сценарии и внешние стимулы для вызова различных эмоциональных состояний."
Как реализовать систему управления героем с возможностью смены классов?,Реализуйте систему управления героем с возможностью смены классов. Предоставьте игрокам выбор между различными классами персонажей с уникальными навыками и стилями игры. Обеспечьте механизмы для смены классов в ходе игры.
Как добавить систему голосового управления и взаимодействия с игрой?,"Добавьте систему голосового управления и взаимодействия с игрой, интегрируя технологии распознавания речи. Обеспечьте игрокам возможность командовать персонажем, выполнять действия и взаимодействовать с окружающим миром при помощи голосовых команд."
Как создать и анимировать систему динамически изменяемых исторических событий?,"Создайте и анимируйте систему динамически изменяемых исторических событий. Реализуйте механизм, который позволит событиям в игре эволюционировать и изменяться в зависимости от действий игрока, создавая богатую историческую составляющую."
Как реализовать систему мультиплеерного взаимодействия между игроками?,"Реализуйте систему мультиплеерного взаимодействия между игроками, обеспечивая возможность совместного прохождения кампании, сражений или кооперативного взаимодействия в игровом мире."
Как настроить систему управления затенением и освещением для создания атмосферы?,"Настройте систему управления затенением и освещением для создания атмосферы в игре. Используйте различные источники света, тени и эффекты, чтобы передать определенное настроение и визуальный стиль."
Как добавить систему генерации и контроля случайных событий в игре?,"Добавьте систему генерации и контроля случайных событий в игре. Используйте алгоритмы для создания разнообразных сценариев и задач, которые могут возникнуть в ходе игры."
Как создать и настроить систему адаптивного искусственного интеллекта врагов?,"Создайте и настройте систему адаптивного искусственного интеллекта врагов. Реализуйте алгоритмы, которые позволят врагам адаптироваться к стилю игры игрока, создавая более сложные и интересные боевые сценарии."
Как реализовать систему изменения игрового мира в зависимости от решений игрока?,"Реализуйте систему изменения игрового мира в зависимости от решений игрока. Предоставьте игрокам возможность влиять на сюжет, окружающую среду и ход событий в игре."
Как настроить систему обратной связи и взаимодействия с сообществом игроков?,"Настройте систему обратной связи и взаимодействия с сообществом игроков. Используйте форумы, обратную связь в игре и социальные платформы для общения с игроками, получения отзывов и внесения изменений в игру."
Как добавить систему создания и обмена моделями и ресурсами с сообществом?,"Добавьте систему создания и обмена моделями и ресурсами с сообществом. Реализуйте инструменты для создания пользовательского контента, а также механизмы обмена им между игроками."
Как создать и анимировать систему живых и реагирующих на окружение горожан?,"Создайте и анимируйте систему живых и реагирующих на окружение горожан. Предоставьте персонажам в игровом мире уникальные реакции на события, изменения и взаимодействие с игроком."
Как реализовать систему генерации процедурных географических карт и миров?,"Реализуйте систему генерации процедурных географических карт и миров, используя алгоритмы шумов, клеточных автоматов или другие подходы. Обеспечьте разнообразие ландшафтов, биомов и географических особенностей в создаваемых мирах."
Как настроить систему реалистичного взаимодействия с физическим окружением?,"Настройте систему реалистичного взаимодействия с физическим окружением. Используйте физические движки для моделирования поведения объектов, их взаимодействия с персонажем и окружающим миром."
Как добавить систему анимации для интерактивных кинематографичных сцен?,"Добавьте систему анимации для интерактивных кинематографичных сцен. Создайте анимации, реагирующие на действия игрока, диалоги и ключевые моменты сюжета, чтобы сцены выглядели более динамичными и захватывающими."
Как создать и настроить систему эмоциональных и психологических состояний персонажей?,"Создайте и настройте систему эмоциональных и психологических состояний персонажей. Используйте механики, которые отражают эмоциональные переживания персонажей, их воздействие на сюжет и взаимодействие с окружающими."
Как реализовать систему поддержки различных уровней сложности врагов?,"Реализуйте систему поддержки различных уровней сложности врагов. Создайте алгоритмы, которые адаптируют поведение и силу врагов в зависимости от уровня навыков игрока."
Как настроить систему обратной связи для сбора данных и улучшения игры?,"Настройте систему обратной связи для сбора данных и улучшения игры. Внедрите механизмы сбора статистики, отзывов игроков и аналитики, чтобы оптимизировать геймплей и исправлять возможные недочеты."
Как добавить систему прогнозирования и адаптивного изменения игрового сценария?,"Добавьте систему прогнозирования и адаптивного изменения игрового сценария. Используйте алгоритмы, которые предсказывают действия игрока и адаптируют сюжет, чтобы поддерживать интерес и вовлеченность."
Как создать и анимировать систему изменяемых и разрушаемых строений?,"Создайте и анимируйте систему изменяемых и разрушаемых строений. Обеспечьте возможность игрокам влиять на окружающий мир, разрушая и строя собственные структуры."
Как реализовать систему изменения внешнего вида персонажей в зависимости от событий?,"Реализуйте систему изменения внешнего вида персонажей в зависимости от событий. Используйте механики, которые позволяют персонажам эволюционировать, стареть или изменять свой внешний облик в соответствии с сюжетом."
Как настроить систему анимации и визуализации воздушных и космических боев?,"Настройте систему анимации и визуализации воздушных и космических боев. Создайте динамичные боевые сцены, включая анимации полета, взаимодействия с пространством и специфические эффекты."
Как добавить систему поддержки асинхронных многопользовательских режимов?,"Добавьте систему поддержки асинхронных многопользовательских режимов. Обеспечьте возможность игрокам взаимодействовать друг с другом в реальном времени или асинхронно, сохраняя состояние игры между сессиями."
Как создать и настроить систему анимированных голографических интерфейсов?,Создайте и настройте систему анимированных голографических интерфейсов. Используйте современные технологии анимации и визуализации для создания привлекательных и функциональных голографических элементов интерфейса.
Как реализовать систему динамического изменения цвета и освещения мира?,"Реализуйте систему динамического изменения цвета и освещения мира. Используйте динамические эффекты цветокоррекции, освещения и теней, чтобы создать изменчивую атмосферу в игровом мире."
Как настроить систему адаптивного звука для поддержки разных сценариев?,"Настройте систему адаптивного звука для поддержки разных сценариев. Используйте технологии пространственного звука и адаптивных алгоритмов, чтобы звуковое сопровождение соответствовало динамике игрового процесса."
Как добавить систему генерации и управления динамическим изменением погоды?,"Добавьте систему генерации и управления динамическим изменением погоды. Внедрите разнообразные погодные условия, влияющие на геймплей и атмосферу игры."
Как создать и анимировать систему изменяемых и эволюционирующих существ?,"Создайте и анимируйте систему изменяемых и эволюционирующих существ. Предоставьте персонажам возможность развиваться, эволюционировать и изменять свою внешность в зависимости от действий игрока."
Как реализовать систему генерации случайных ландшафтов и природных объектов?,"Реализуйте систему генерации случайных ландшафтов и природных объектов. Используйте алгоритмы процедурной генерации, чтобы создавать уникальные ландшафты и природные элементы в каждой игровой сессии."
Как настроить систему реакции на изменения характеристик и состояния персонажа?,Настройте систему реакции на изменения характеристик и состояния персонажа. Обеспечьте реалистичные и визуально заметные изменения внешности и поведения персонажа при изменении его характеристик.
Как реализовать систему динамического изменения формы и размера вражеских юнитов?,"Реализуйте систему динамического изменения формы и размера вражеских юнитов. Создайте врагов, способных изменять свою форму и размер в зависимости от сценария или действий игрока."
Как добавить систему генерации уникальных звуковых дорожек для разных сцен и уровней?,"Добавьте систему генерации уникальных звуковых дорожек для разных сцен и уровней. Используйте разнообразные звуковые эффекты и музыку, соответствующую атмосфере каждого игрового момента."
Как создать и настроить систему автоматического создания текстур для моделей и объектов?,"Создайте и настройте систему автоматического создания текстур для моделей и объектов. Используйте алгоритмы генерации текстур, основанные на характеристиках моделей, для создания реалистичных и разнообразных текстур."
Как реализовать систему анимированных системных уведомлений и ачивментов?,"Реализуйте систему анимированных системных уведомлений и ачивментов. Создайте анимационные эффекты, сопровождающие системные уведомления и достижения, чтобы делать игровой опыт более захватывающим."
