Question,Answer
Как реализовать систему изменения формы и внешнего вида объектов окружения под воздействием событий в игре?,"Реализуйте систему изменения формы и внешнего вида объектов окружения под воздействием событий в игре, внедрив механизмы, которые адаптируют текстуры, модели и параметры объектов в зависимости от происходящих событий."
Как настроить систему динамического изменения звукового оформления в зависимости от игрового контекста?,"Настройте систему динамического изменения звукового оформления в зависимости от игрового контекста. Используйте адаптивные аудиоэффекты, реагирующие на действия игрока, окружающую обстановку и события в игре."
Как добавить систему создания и управления персональными историями виртуальных племен и обществ в игре?,"Добавьте систему создания и управления персональными историями виртуальных племен и обществ в игре, предоставляя игрокам возможность влиять на судьбы персонажей и обществ виртуального мира."
Как создать и анимировать систему изменяемых и эволюционирующих элементов виртуальной экосистемы?,"Создайте и анимируйте систему изменяемых и эволюционирующих элементов виртуальной экосистемы, учитывая взаимодействие между различными видами живых существ, растениями и окружающей средой."
Как реализовать систему изменения формы и поведения NPC в зависимости от их социального статуса и роли в обществе?,"Реализуйте систему изменения формы и поведения NPC в зависимости от их социального статуса и роли в обществе, предоставляя персонажам характеристики и поведение, соответствующие их статусу в игровом мире."
Как добавить систему интеллектуального поиска пути для NPC в игре?,"Добавьте систему интеллектуального поиска пути для NPC в игре, используя алгоритмы, которые позволяют персонажам эффективно перемещаться по игровому миру, избегая препятствий и принимая решения на основе окружающей обстановки."
Как создать эффективную систему управления камерой в режиме реального времени?,"Создайте эффективную систему управления камерой в режиме реального времени, предоставляя игрокам удобные инструменты для наблюдения за игровым миром, изменения ракурса и фокусировки на интересующих объектах."
Как настроить систему искусственного интеллекта для дружественных NPC?,"Настройте систему искусственного интеллекта для дружественных NPC, обеспечивая им адаптивное поведение, реакцию на действия игрока и способность сотрудничества в различных ситуациях."
Как реализовать эффектные визуальные эффекты для магии и заклинаний в игре?,"Реализуйте эффектные визуальные эффекты для магии и заклинаний в игре, используя современные технологии графики, частицы, текстуры и шейдеры для создания захватывающих и красочных визуальных элементов."
Как добавить систему случайных встреч с различными персонажами в игре?,"Добавьте систему случайных встреч с различными персонажами в игре, учитывая контекст и сценарии, чтобы создать разнообразные и интересные ситуации для игрока."
Как создать реалистичные звуковые эффекты для природы и окружения в игре?,"Создайте реалистичные звуковые эффекты для природы и окружения в игре, используя высококачественные аудиозаписи, пространственное звучание и динамическую адаптацию к игровой обстановке."
Как настроить систему динамического изменения размеров и форм игровых объектов?,"Настройте систему динамического изменения размеров и форм игровых объектов, предоставляя им возможность изменяться под воздействием игровых событий или решений игрока."
Как реализовать систему изменения окружающей среды под воздействием игровых событий?,"Реализуйте систему изменения окружающей среды под воздействием игровых событий, внедрив механизмы, которые позволяют изменять ландшафт, погодные условия и другие параметры окружения."
Как добавить систему управления динамическими световыми и теневыми эффектами в игре?,"Добавьте систему управления динамическими световыми и теневыми эффектами в игре, используя освещение в реальном времени, динамические источники света и технологии глобальной освещенности."
Как создать интересные и непредсказуемые повороты сюжета в игре?,"Создайте интересные и непредсказуемые повороты сюжета в игре, внедрив в сценарий неожиданные события, выборы игрока и влияние его решений на развитие сюжета."
Как настроить систему динамического изменения цвета и освещения внутри игровых помещений?,"Настройте систему динамического изменения цвета и освещения внутри игровых помещений, обеспечивая атмосферность и адаптацию к контексту игровых событий."
Как реализовать систему изменения параметров звука в зависимости от расположения игрового персонажа?,"Реализуйте систему изменения параметров звука в зависимости от расположения игрового персонажа, используя технологии пространственного аудио и звукового дизайна для создания уникального звукового опыта."
Как добавить систему динамического изменения уровня сложности в зависимости от игрового опыта?,"Добавьте систему динамического изменения уровня сложности в зависимости от игрового опыта, учитывая навыки игрока, его решения и успехи, чтобы обеспечить баланс и вызов в игровом процессе."
Как создать атмосферные звуковые эффекты для различных природных условий в игре?,"Создайте атмосферные звуковые эффекты для различных природных условий в игре, используя звуковые библиотеки, аудиодизайн и технологии пространственного звука для улучшения атмосферы игрового мира."
Как настроить систему реалистичных анимаций для различных типов движения персонажей?,"Настройте систему реалистичных анимаций для различных типов движения персонажей, учитывая физические законы, контекст сцен, и добавив разнообразие анимаций для улучшения визуальной привлекательности."
Как реализовать систему изменения анимаций персонажей в зависимости от их эмоционального состояния?,"Реализуйте систему изменения анимаций персонажей в зависимости от их эмоционального состояния, интегрируя механизмы, учитывающие эмоции, события и взаимодействия в игре."
Как добавить систему управления искусственным интеллектом вражеских боссов в игре?,"Добавьте систему управления искусственным интеллектом вражеских боссов в игре, предоставляя им уникальные тактики, способности и адаптивное поведение в боевых сценариях."
Как создать эффектные визуальные эффекты для метеорологических явлений в игре?,"Создайте эффектные визуальные эффекты для метеорологических явлений в игре, используя частицы, шейдеры и текстуры для передачи реалистичных и захватывающих погодных условий."
Как настроить систему динамического изменения масштабов игрового мира в различных локациях?,"Настройте систему динамического изменения масштабов игрового мира в различных локациях, предоставляя игроку ощущение разнообразия и пропорций в различных игровых областях."
Как реализовать систему изменения анимаций для динамических сценариев в игре?,"Реализуйте систему изменения анимаций для динамических сценариев в игре, учитывая контекст, события и воздействие игрока на ход сюжета."
Как добавить систему случайных миссий и событий в открытом мире игры?,"Добавьте систему случайных миссий и событий в открытом мире игры, предоставляя игроку разнообразные задачи и вызовы при исследовании игрового мира."
Как создать реалистичные звуковые эффекты для различных видов оружия в игре?,"Создайте реалистичные звуковые эффекты для различных видов оружия в игре, уделяя внимание звучанию выстрелов, ударов, перезарядке и другим аспектам для улучшения аудиоопыта игрока."
Как настроить систему динамического изменения эффектов взрывов и разрушений в игре?,"Настройте систему динамического изменения эффектов взрывов и разрушений в игре, используя частицы, физическое моделирование и шейдеры для создания реалистичных и впечатляющих визуальных эффектов."
Как реализовать систему изменения анимаций для динамических элементов окружения в игре?,"Реализуйте систему изменения анимаций для динамических элементов окружения в игре, позволяя объектам взаимодействовать с окружающей средой и другими объектами с учетом их состояния и воздействия."
Как добавить систему управления кинематографическими камерами в игре?,"Добавьте систему управления кинематографическими камерами в игре, чтобы создавать увлекательные и кинематографичные камерные углы обзора, подчеркивая важные моменты в игровом процессе."
Как создать эффективную систему искусственного интеллекта для толп NPC в игре?,"Создайте эффективную систему искусственного интеллекта для толп NPC в игре, учитывая их поведение, взаимодействие, и реализуя адаптивное поведение в зависимости от сценария и событий."
Как настроить систему динамического изменения эффектов осадков в игровом мире?,"Настройте систему динамического изменения эффектов осадков в игровом мире, учитывая время суток, сезоны и другие факторы для создания разнообразной атмосферы."
Как реализовать систему изменения анимаций для персональных историй персонажей в игре?,"Реализуйте систему изменения анимаций для персональных историй персонажей в игре, отражая их эмоциональное состояние, решения и взаимоотношения с другими персонажами."
Как добавить систему управления эффектами освещения и сенсорики в игровых сценах?,"Добавьте систему управления эффектами освещения и сенсорики в игровых сценах, предоставляя возможность настраивать яркость, цветовую гамму и другие параметры освещения в реальном времени."
"Как создать динамическую музыкальную атмосферу, реагирующую на действия игрока?","Создайте динамическую музыкальную атмосферу, реагирующую на действия игрока, интегрируя систему музыкальных тем, которые соответствуют текущему состоянию игры."
Как настроить систему реалистичных физических эффектов для различных типов поверхностей в игре?,"Настройте систему реалистичных физических эффектов для различных типов поверхностей в игре, учитывая трение, упругость и другие факторы для создания реалистичного поведения объектов."
Как реализовать систему изменения анимаций для динамических сценариев диалогов в игре?,"Реализуйте систему изменения анимаций для динамических сценариев диалогов в игре, предоставляя разнообразные анимации и выражения в зависимости от контекста и выборов игрока в диалогах."
Как добавить систему случайного генерирования событий и инцидентов в городах игрового мира?,"Добавление системы случайного генерирования событий в городах игрового мира можно реализовать через создание разнообразных сценариев и миссий с использованием генерации случайных параметров, таких как тип события, участники, место и время."
Как создать эффектные визуальные эффекты для магических атак и заклинаний в игре?,"Создание эффектных визуальных эффектов для магических атак и заклинаний в игре включает в себя разработку качественных текстур, использование шейдеров для особых световых и частицевых эффектов, анимаций и звукового оформления."
Как настроить систему динамического изменения атмосферы и освещения в подземельях?,"Настройка системы динамического изменения атмосферы и освещения в подземельях может быть достигнута через использование шейдеров, изменение текстур и источников света в реальном времени в зависимости от событий и условий."
Как реализовать систему изменения анимаций для динамических элементов интерфейса в игре?,"Реализация системы изменения анимаций для динамических элементов интерфейса включает в себя создание анимаций для различных состояний интерфейсных элементов, таких как наведение, клик и изменение параметров."
Как добавить систему управления поведением персонажей в многопользовательском режиме?,"Добавление системы управления поведением персонажей в многопользовательском режиме требует синхронизации действий и взаимодействия между клиентами, а также обработки действий других игроков и обновления состояний персонажей в реальном времени."
Как создать зрелищные эффекты для входов и выходов из порталов и телепортов в игре?,"Создание зрелищных эффектов для входов и выходов из порталов и телепортов включает в себя анимацию порталов, эффекты перехода между мирами и звуковое оформление, подчеркивающее магию и загадочность."
Как настроить систему реалистичного воздействия погоды на физические объекты в игре?,"Настройка системы реалистичного воздействия погоды на физические объекты может включать в себя изменение поведения персонажей и окружающей среды под воздействием дождя, снега или других погодных явлений."
Как реализовать систему изменения анимаций для динамических элементов виртуальной экосистемы?,"Реализация системы изменения анимаций для динамических элементов виртуальной экосистемы требует анимирования объектов, реагирующих на изменения в окружающей среде и взаимодействующих между собой."
Как добавить систему управления динамическим изменением времени суток в игре?,"Добавление системы управления динамическим изменением времени суток в игре может быть выполнено через изменение освещения, цветовой палитры и других параметров в зависимости от текущего времени."
Как создать эффективную систему искусственного интеллекта для групповых сражений в игре?,"Создание эффективной системы искусственного интеллекта для групповых сражений включает в себя разработку алгоритмов тактического поведения, координации действий и взаимодействия между членами группы."
Как настроить систему динамического изменения звуковых эффектов в различных игровых ситуациях?,"Настройка системы динамического изменения звуковых эффектов в различных игровых ситуациях включает в себя использование аудио-менеджера для управления громкостью, тональностью, реверберацией и выбором звуковых дорожек в зависимости от контекста, такого как бои, плавание, диалоги и другие."
Как реализовать систему изменения анимаций для динамических сценариев драк в игре?,"Реализация системы изменения анимаций для динамических сценариев драк в игре включает в себя создание анимаций для различных типов атак, блоков, уворотов и других движений персонажей в зависимости от текущей ситуации в бою."
