Question,Answer
Как создать систему чатов и многопользовательской коммуникации в игре?,"Для создания системы чатов и коммуникации в игре, вы можете использовать сетевые библиотеки, такие как Photon или Mirror для Unity. Реализуйте серверный и клиентский код для передачи сообщений между игроками, а также добавьте интерфейс чата в вашем игровом клиенте."
Как интегрировать систему аналитики для отслеживания поведения игроков?,"Для интеграции системы аналитики в ваш проект, выберите платформу аналитики (например, Google Analytics, Mixpanel) и добавьте код отслеживания событий, таких как действия игроков, в вашем приложении. Анализируйте полученные данные для оптимизации геймплея и вовлеченности игроков."
Как добавить систему многопользовательского кооперативного режима в игру?,"Для многопользовательского кооперативного режима реализуйте сервер-клиентскую архитектуру сетевого взаимодействия. Синхронизируйте состояние игрового мира между клиентами и сервером, обеспечивая взаимодействие между игроками в реальном времени."
Как настроить систему обратной связи от игроков для улучшения проекта?,"Создайте форму обратной связи внутри игры, где игроки могут оставлять комментарии и предложения. Интегрируйте механизм отправки отзывов на сервер и регулярно анализируйте полученные отзывы для внесения улучшений в проект."
"Как создать и анимировать водные поверхности (реки, озера) в игре?","Для создания и анимации водных поверхностей используйте технику шейдеров для симуляции водных эффектов. Реализуйте динамические текстуры, отражения и рефракции, чтобы придать воде естественный вид. Анимируйте текстуры для создания визуального эффекта плавающей водной поверхности."
Как реализовать систему взаимодействия с объектами с использованием VR-технологий?,"Для взаимодействия с объектами в VR используйте контроллеры VR и библиотеки, такие как SteamVR или Oculus SDK. Реализуйте логику схватывания, перемещения и взаимодействия с объектами с учетом виртуальной реальности."
Как добавить систему прогрессии и уровней для персонажей в ролевой игре?,"Создайте систему опыта и уровней, где игроки могут зарабатывать опыт за выполнение заданий и сражения. Реализуйте систему навыков, атрибутов и возможности улучшения персонажа по мере прогресса в уровнях."
Как создать систему динамического изменения погоды в игровом мире?,"Используйте систему частиц для создания эффектов дождя, снега, тумана и других погодных явлений. Реализуйте систему изменения параметров освещения, текстур и звуков в зависимости от текущей погоды в игре."
Как настроить систему динамической подсветки для подсветки объектов в реальном времени?,"Используйте технику динамического освещения, такую как Global Illumination (GI) или Real-time Ray Tracing, для создания реалистичных эффектов подсветки объектов в зависимости от источников света и их распределения в сцене."
Как реализовать систему арт-дизайна и создания уникального стиля для игры?,"Разработайте четкий арт-дизайн и стиль для игры, определите палитру цветов, типы текстур и общий эстетический подход. Обеспечьте согласованность стиля во всех аспектах игры, включая персонажей, окружение и интерфейс."
Как добавить систему турниров и соревнований в многопользовательскую игру?,"Реализуйте систему управления сценами с использованием пулов объектов для эффективного создания и уничтожения персонажей. Внедрите алгоритмы генерации сцен, учитывая баланс и производительность, чтобы обеспечить плавный геймплей."
Как создать систему генерации и управления массовыми сценами с множеством персонажей?,"Используйте алгоритмы генерации музыки, которые реагируют на игровые события и изменяются динамически. Разработайте систему слоев и треков, которые могут включаться и выключаться в зависимости от происходящих в игре событий."
Как реализовать систему динамической генерации музыки в зависимости от игровых событий?,"Используйте популярные системы контроля версий, такие как Git, для отслеживания изменений в коде, ресурсах и конфигурациях проекта. Разделяйте разработку на ветви, внимательно коммитьте изменения и регулярно сливайте их для обеспечения согласованности."
Как использовать систему контроля версий для управления разработкой игры?,"Внедрите инструменты отладки и профилирования, такие как Visual Studio Debugger, Unity Profiler или аналогичные средства разработки. Измеряйте производительность, выявляйте узкие места и оптимизируйте код для улучшения производительности."
Как настроить систему отладки и профилирования для повышения производительности?,"Реализуйте сервер для хранения и распространения обновлений и патчей. Используйте протоколы передачи данных, такие как HTTP или FTP, для загрузки обновлений. Разработайте клиентскую систему, способную автоматически обновлять игру при наличии новых версий."
Как создать и реализовать сетевую систему обновлений и патчей для игры?,"Адаптируйте интерфейс и графику игры для различных разрешений экранов, используя анкоры, разметку и системы адаптивного дизайна. Реализуйте масштабирование и обработку различных соотношений сторон экранов."
Как интегрировать систему динамической поддержки разрешения для различных экранов?,"Разработайте систему генерации случайных событий, которая может влиять на геймплей, сюжет и окружение. Используйте вероятностные алгоритмы и параметры для управления частотой и характером случайных событий."
Как добавить систему случайных событий для улучшения динамики игры?,"Внедрите систему управления кинематографичными сценами, которая позволяет создавать и редактировать камерные настройки, анимации персонажей и сценарии. Используйте режиссерские инструменты для создания кинематографичных моментов в игре."
Как реализовать систему создания и управления кинематографичными сценами в игре?,"Реализуйте систему обнаружения взаимодействия с объектами, используя коллайдеры и триггеры. Привяжите к объектам скрипты, которые обрабатывают игровые действия, такие как нажатия кнопок или использование предметов."
"Как настроить систему интерактивных объектов, реагирующих на игровые действия?","Используйте различные эффекты окружающей среды, такие как частицы, объемные света, туман и изменение цветовой гаммы, чтобы создать атмосферу в игре. Регулируйте эффекты в зависимости от текущего состояния сцены или событий в игре."
Как создать систему эффектов окружающей среды для улучшения атмосферы игры?,"Интегрируйте систему телеметрии для сбора данных о действиях игроков, их предпочтениях и прохождении уровней. Анализируйте эти данные для выявления трендов и улучшения геймплея, баланса и вовлеченности."
Как использовать систему телеметрии для анализа поведения игроков и улучшения геймплея?,"Разработайте систему валюты, магазина и предметов для покупки. Используйте балансировку цен и виртуальных товаров для поддержания экономической устойчивости. Внедрите механизмы монетизации, такие как микротранзакции."
Как реализовать систему виртуальной экономики и магазина внутри игры?,"Разработайте систему искусственного интеллекта (ИИ), используя алгоритмы принятия решений, такие как state machines или алгоритмы машинного обучения. Программируйте поведение персонажей и NPC, чтобы они могли адаптироваться к сценариям и взаимодействовать с игроком."
Как добавить систему искусственного интеллекта для динамического,"Реализуйте систему управления транспортом, такую как автомобили, летательные аппараты или лошади. Создайте физические модели и управляющие скрипты для передвижения, учитывая различные типы транспорта."
Как добавить систему транспорта и передвижения по игровому миру?,"Разработайте систему боевых механик, включая атаки, блокировки, умения и систему здоровья. Используйте анимации, физический движок и балансировку для создания динамичных и увлекательных сражений."
Как реализовать систему динамических сражений и боевых механик?,"Используйте технику динамического освещения, такую как Real-time Global Illumination (GI) или освещение с использованием shadow mapping. Регулируйте параметры света в зависимости от размеров помещения и источников света."
Как настроить систему динамического освещения внутри помещений?,"Реализуйте систему динамических текстур, позволяющую объектам изменять текстуры в реальном времени. Это может использоваться для эффектов повреждений, смены времени суток и других динамических изменений."
Как создать и использовать систему динамических текстур для объектов?,"Разработайте систему управления загрузкой уровней, которая работает в фоновом режиме, чтобы избежать перерывов в геймплее. Используйте асинхронные методы загрузки ресурсов и уровней."
Как реализовать систему загрузки уровней в фоновом режиме?,"Используйте платформы краудфандинга, такие как Kickstarter или Indiegogo, для сбора средств на разработку игры. Создайте убедительную кампанию с видео, концепт-артом и привлекательными наградами для поддержки."
Как добавить систему краудфандинга и финансирования для проекта?,"Интегрируйте технологии виртуальной реальности (VR) для создания уникального и погружающего геймплея. Разработайте интерфейс, который взаимодействует с VR-оборудованием, и учтите особенности виртуального мира в дизайне уровней и сцен."
Как использовать систему виртуальной реальности для создания уникального геймплея?,"Разработайте интерактивные туториалы и задания, которые пошагово знакомят новичков с основами геймплея. Внедрите систему подсказок и обратной связи, чтобы помочь игрокам освоить управление и ключевые механики."
Как создать систему обучения новичков и туториалов в игре?,"Используйте алгоритмы ранжирования, учитывающие достижения и результаты игроков. Реализуйте лидерборды, которые позволяют игрокам сравнивать свои достижения и соревноваться в рейтинге."
Как настроить систему ранжирования и лидербордов для соревнований игроков?,"Внедрите систему античита, которая проверяет целостность игровых файлов и мониторит поведение игроков. Используйте алгоритмы обнаружения читов и средства защиты от несанкционированных изменений."
Как реализовать систему античита для защиты от читеров и мошенников?,"Используйте техники программирования растительности, такие как Procedural Generation или системы частиц, чтобы создать динамическую природу. Реализуйте сезонные изменения, взаимодействие с погодой и эффекты роста растений."
Как добавить систему динамической растительности и природы в игру?,"Разработайте систему управления звуком, включающую амбиентные звуки, звуковые эффекты и музыкальное сопровождение. Используйте техники аудиодизайна, чтобы создать уникальные звуковые эффекты, соответствующие событиям и действиям в игре."
Как настроить систему аудиодизайна и создать уникальные звуковые эффекты?,"Внедрите систему, учитывающую факторы, влияющие на жизненный цикл персонажей и мира, такие как время суток, погода и циклы ресурсов. Разработайте механизмы эволюции и взаимодействия для создания живого и динамичного игрового мира."
Как реализовать систему симуляции жизненного цикла персонажей и мира?,"Используйте движущиеся элементы, анимации и спецэффекты для создания кинетического искусства в игре. Реализуйте механизмы взаимодействия с этими элементами, чтобы игроки могли влиять на окружающую их среду."
Как создать систему кинетического искусства и движущихся инсталляций в игре?,"Разработайте алгоритмы генерации уровней и контента, учитывающие разнообразие и интересность. Используйте случайные элементы и параметры для создания уникальных игровых ситуаций."
Как использовать систему генерации искусственного контента для уровней и мира?,"Разработайте пользовательский интерфейс, оптимизированный для мобильных устройств, и добавьте сенсорные контроллеры для управления. Обеспечьте поддержку различных устройств и экранов."
Как настроить систему управления и взаимодействия с игрой через мобильные устройства?,"Внедрите систему эмоций и реакций персонажей на действия игрока. Используйте анимации лиц, диалоги и систему искусственного интеллекта для создания эмоциональной связи между персонажами и игроком."
Как добавить систему эмоциональной связи между персонажами и игроком?,Предоставьте возможность разработчикам создавать и интегрировать моды через специальные API и инструменты. Обеспечьте документацию и сообщество для поддержки мододелов.
Как реализовать систему поддержки модов и создания пользовательских контентов?,"Разработайте систему динамических сюжетных линий, учитывающую действия игрока. Используйте диалоги, события и систему выборов для создания персональных историй персонажей."
Как создать систему сюжетных линий и персональных историй для персонажей?,"Используйте музыку, звуковые эффекты, анимации и сценарии, чтобы вызывать эмоции у игрока. Реализуйте систему динамического адаптивного поведения игры, реагирующую на эмоциональное состояние игрока."
Как настроить систему психологического воздействия на игрока и создания эмоциональных переживаний?,"Интегрируйте технологии виртуальной и дополненной реальности для взаимодействия с физическим миром. Используйте датчики, камеры и контроллеры для создания инновационных игровых механик."
Как добавить систему взаимодействия с физическим миром через различные устройства?,"Разработайте унифицированную систему, поддерживающую и виртуальную реальность, и аугментированную реальность. Обеспечьте настройки и опции для адаптации игры к различным устройствам VR и AR."
Как реализовать систему виртуальной реальности и аугментированной реальности в едином проекте?,"Внедрите систему динамической рекламы, которая может адаптироваться к контексту игры. Используйте аналитику для персонализации рекламы и максимизации вовлеченности."
Как создать систему динамической рекламы и продвижения внутри игры?,"Разработайте универсальный код, поддерживающий различные платформы, такие как PC, консоли и мобильные устройства. Тестируйте и оптимизируйте игру для каждой платформы."
Как настроить систему поддержки различных платформ и устройств для максимальной аудитории?,"Используйте фреймворки для автоматизированного тестирования. Создайте тестовые сценарии для проверки ключевых функций игры, производительности и стабильности."
